id,created_at,text
1050638116464119808,2018-10-12 06:43:41,"b""@MinhxD Hi there, we're sorry to hear this. As our  travel insurance is underwritten by our insurance partner, AIG,\xe2\x80\xa6 https://t.co/8ERGoNJnDF"""
1050626903109820416,2018-10-12 05:59:08,"b""@HKTBlog_Dom Hi there, we're sorry to hear this. May we know if you've since received the necessary booking assistance? Thank you."""
1050617838795288578,2018-10-12 05:23:06,"b'@sophj9219 Hi Sophie, to better inform you on your query, you may wish to click here: https://t.co/qJh6pbFKfd for m\xe2\x80\xa6 https://t.co/kRnKp02Q8q'"
1050616679732891648,2018-10-12 05:18:30,"b""@HenryZhao2 Hi Henry, we're sorry to hear this. May we know if you currently seek booking assistance? Thank you."""
1050603680964046848,2018-10-12 04:26:51,"b""@scottie_what Hi Scott, we're sorry to hear this. May we know more details on what was last advised to you by the baggage team? Thank you."""
1050567011917553670,2018-10-12 02:01:08,"b""@sitsm Hi Siti, may we clarify what the error message is that you've been receiving whilst trying to do an online check-in? Thank you."""
1050566442586951681,2018-10-12 01:58:53,"b""@kgunnels Hi Kyle, we're sorry to hear this. May we seek your baggage report number, previously corresponded emails\xe2\x80\xa6 https://t.co/MZku4k34OP"""
1050558793694830592,2018-10-12 01:28:29,"b""@sitsm Hi Siti, we're sorry to hear this. May we suggest you try clearing your cache before accessing our website a\xe2\x80\xa6 https://t.co/a1ClwNiYS0"""
1050557783471472641,2018-10-12 01:24:28,"b'@garzonmejiamar Thank you for your kind words and support, Carlos!'"
1050546451670081537,2018-10-12 00:39:26,"b'@sitsm Hi Siti, may we check if you have been able to access it since? Thank you.'"
1050541268206542848,2018-10-12 00:18:51,"b'@VernonGreen20 Hi there, we would like to thank you for your feedback and seek your understanding that these decisi\xe2\x80\xa6 https://t.co/yQjrBqhZAS'"
1050540440200601600,2018-10-12 00:15:33,"b'@RainerNievesD Hi Rainer, the KIX route is currently operated by the A330-300. Thank you.'"
1050524314519388160,2018-10-11 23:11:29,"b""@SamChipperfield You're very welcome, Sam. Do reach out to us if you have anymore queries :)"""
1050522088988073985,2018-10-11 23:02:38,b'@SamChipperfield You may wish to have a look on our Krisshop page; https://t.co/R2WCCqpvY0 :)'
1050517958554988544,2018-10-11 22:46:13,"b'@SamChipperfield Hi Sam, may we clarify if you are looking to purchase a aircraft model? Thank you.'"
1050489047674707968,2018-10-11 20:51:20,"b'@c_briscombe Hi Cheryl, may we check if you have managed to reach an agent yet? Thank you.'"
1050450089322405892,2018-10-11 18:16:32,"b'@_MarkMahon Thanks for the support, Mark :)'"
1050410506660532224,2018-10-11 15:39:15,"b'@k2k_moo Thank you, Karthik. We look forward to welcoming you onboard soon :)'"
1050410254306091010,2018-10-11 15:38:14,"b'@ChadhaSatinder Thanks for the support, Satinder :)'"
1050369714986209280,2018-10-11 12:57:09,b'Celebrating the launch of our non-stop flight from Singapore to New York on the new Airbus A350 Ultra Long Range! https://t.co/8ZKP2JaZ6y'
1050330861479108608,2018-10-11 10:22:46,"b'@tong_sf Hi Siew Fong, you may contact your local SIA office and our colleagues there will be able to sort that out\xe2\x80\xa6 https://t.co/PHRMMsZvmq'"
1050312696577576960,2018-10-11 09:10:35,"b'@apmd5 You are welcome, Sir.'"
1050312321489391616,2018-10-11 09:09:05,"b'@broewnis Hi Ahmad, yes, we are re-launching our non-stop flights to Newark, NY tonight. :)'"
1050303405170810880,2018-10-11 08:33:40,"b'@i0n1c Hi Stefan, thank you for highlighting that, which we will share with our IT team to look into. Thank you.'"
1050298221711347712,2018-10-11 08:13:04,b'Experience the magic of Osaka after dark. #FlySQ and experience the nightlife. https://t.co/YwS8t0TDoK'
1050285694780932096,2018-10-11 07:23:17,"b'@JackDunc1 Sorry to hear that, Jack. We are unable to use the DM function currently. Please email your booking ref\xe2\x80\xa6 https://t.co/SqTNUONsS7'"
1050283397006970881,2018-10-11 07:14:09,"b""@apmd5 Hi, you'll need to contact the baggage department for an update if you have not gotten your baggage. If you\xe2\x80\xa6 https://t.co/rHkPIz8HNo"""
1050280146563977217,2018-10-11 07:01:14,"b'@hareandbonetim Hi Tim, sorry to hear that. However, switching of names in bookings (swapping of persons) is not al\xe2\x80\xa6 https://t.co/hG5bGxlJyG'"
1050278999258275841,2018-10-11 06:56:41,"b'@apmd5 Hi, did you make a report when you arrived in Singapore? Thank you.'"
1050277779831488512,2018-10-11 06:51:50,"b'@izainabmakki Hi, the inaugural flight is actually departing tonight from Singapore. However, you may still purchas\xe2\x80\xa6 https://t.co/tEFUQkNvGh'"
1050273316697726976,2018-10-11 06:34:06,"b'@apmd5 Hi, may we know the nature of the query that you will need reverting? Thank you.'"
1050267756308951040,2018-10-11 06:12:00,"b'@apmd5 That is correct, based on the flight number that you have provided.'"
1050264719674802176,2018-10-11 05:59:56,"b'@apmd5 Hi, you will need to lodge a report with the operating carrier at the arrival station. Thank you.'"
1050236161069932544,2018-10-11 04:06:27,"b""@ksprashu Hi Prashanth, sorry for the delay. We'll send a reminder to the relevant department (KrisShop) to follow\xe2\x80\xa6 https://t.co/ikimWC3giV"""
1050215351626190850,2018-10-11 02:43:46,"b'@romajoshi Hi, we have replied to your email yesterday. Please be assured you will get a response from the relevant\xe2\x80\xa6 https://t.co/hEJgB6Ik98'"
1050191030694408192,2018-10-11 01:07:07,"b'@chrismdwyer Hi Chris, we understand from the relevant department that they have responded to your request via emai\xe2\x80\xa6 https://t.co/zAPO6y2j9y'"
1050188963300950016,2018-10-11 00:58:55,"b""@charmaineque888 Hi Charmaine, thank you for your kind words, which we'll share with the staff concerned. Looking f\xe2\x80\xa6 https://t.co/Gc76MBLODR"""
1050160064198307840,2018-10-10 23:04:04,"b'@katarinazimmer Hi Katya, the plastic wrap is intended to contain both the snack pack and serviette.'"
1050158492592558081,2018-10-10 22:57:50,"b'@JackDunc1 Hi Jack, we are not able to accept DMs, but if your email is regarding a flight booking, you may wish to\xe2\x80\xa6 https://t.co/j74ErtMDcq'"
1050101001024413697,2018-10-10 19:09:23,"b""@OriginalMattyG Hi Matty, we'd like to share that we have notified our ground staff in Singapore regarding your onw\xe2\x80\xa6 https://t.co/Tw65yuiGO7"""
1050083295575384064,2018-10-10 17:59:01,"b'@anuj__007 Sorry to hear this, Anuj. May we seek your booking reference number, baggage tag number and contact numb\xe2\x80\xa6 https://t.co/LwdBJxhCf6'"
1050081098183712768,2018-10-10 17:50:18,"b""@OriginalMattyG Additionally, we'd like to clarify that the time we stated earlier should be in AM and not PM."""
1050080772344950784,2018-10-10 17:49:00,"b'@OriginalMattyG Hi Matty, we appreciate your feedback and would like to see how our Reservations colleagues can bes\xe2\x80\xa6 https://t.co/DCTAPjbPQF'"
1050077520425570306,2018-10-10 17:36:05,"b'@AimeeLyme Hi Aimee, may we know which email address you have been sending to? May we request for a forward of the\xe2\x80\xa6 https://t.co/74um2iDXyq'"
1050071190470094848,2018-10-10 17:10:55,"b'@soyy Hi there, we understand from our colleagues on the ground that they will be making another announcement soon.\xe2\x80\xa6 https://t.co/WMIBCD4GWM'"
1050070810977800193,2018-10-10 17:09:25,"b'@OriginalMattyG Hi Matty, our colleagues on the ground say they will be making another announcement soon. Do contin\xe2\x80\xa6 https://t.co/86o9vgO79Q'"
1050068544816340992,2018-10-10 17:00:25,"b'@AimeeLyme Hi Aimee, we are not able to message; may we know if your concern is regarding a flight booking? Thank you.'"
1050062596773212161,2018-10-10 16:36:46,"b'@OriginalMattyG Hi Matty, may we confirm if you are a passenger on this flight? Thank you.'"
1050032217148284928,2018-10-10 14:36:03,"b'@LindsayTink Hi Lindsay, sorry to hear this. We understand that the estimated departure time is 2315 hrs. You may w\xe2\x80\xa6 https://t.co/46LIK0bkR4'"
1050030554534617088,2018-10-10 14:29:27,"b'@DanFastenberg Hi Dan, you may email your queries to Public_Affairs@singaporeair.com.sg, thank you.'"
1050030075759026176,2018-10-10 14:27:33,"b'@vanessaseah Hi Vanessa, would you like us to arrange a callback from our KrisFlyer colleagues to you regarding you\xe2\x80\xa6 https://t.co/0SFFhyJi9A'"
1050000747499311105,2018-10-10 12:31:00,"b'@jaysoncinense Hi Jayson, since your layover is 14 hours long, you should be able to check-in your baggage all the\xe2\x80\xa6 https://t.co/BGwpZrPw5v'"
1049999832931360769,2018-10-10 12:27:22,"b'@sophj9219 Hi Sophie, thank you for the clarification. May we seek your booking reference number and contact detail\xe2\x80\xa6 https://t.co/Bl5ZwQgqvy'"
1049995215195529216,2018-10-10 12:09:01,"b'@FHavg Thank you for the clarification, Firdaus. You may wish to contact your nearest Singapore Airlines office via\xe2\x80\xa6 https://t.co/dFMgVRF4pw'"
1049992949671632896,2018-10-10 12:00:01,"b'@KunjM If your laptop bag exceeds the total dimension of 80cm (the length, width and height combined), it will be c\xe2\x80\xa6 https://t.co/TYZJGXrSKc'"
1049992850832875520,2018-10-10 11:59:38,"b'@KunjM Hi Kunj, you may carry your laptop bag in addition to your hand luggage. However, do note that the maximum d\xe2\x80\xa6 https://t.co/Qp4BNc6kzK'"
1049992392097624064,2018-10-10 11:57:48,"b'@jaysoncinense Hi Jayson, may we check how long your layover is? Thank you.'"
1049990033535631360,2018-10-10 11:48:26,"b'@FHavg Hi Firdaus, may we check if any amount was deducted from your account for this purchase? Thank you.'"
1049972305139589121,2018-10-10 10:37:59,"b'@sophj9219 Hi Sophie, we are sorry to hear this. May we check which number you have tried to call? Thank you.'"
1049956238753222657,2018-10-10 09:34:09,"b'@Cathman Thanks for the clarification, Cathy. You may wish to email Public_Affairs@Singaporeair.com.sg for any queries. Thank you.'"
1049954948081995776,2018-10-10 09:29:01,"b'@kprc16 Hi Kathy, we are sorry to hear this. Our staff are doing all they can to resolve the situation. Passenger s\xe2\x80\xa6 https://t.co/VIdLsrmPBj'"
1049954484661698560,2018-10-10 09:27:11,"b'@southessexgary We look forward to seeing you on board. Have a pleasant journey ahead, Gary :)'"
1049954208890478592,2018-10-10 09:26:05,"b'@Cathman Hi Cathy, may we know the nature of your query? Thank you.'"
1049949277626224642,2018-10-10 09:06:29,b'@vanessaseah board as we strive to improve\n our KrisFlyer programme offerings.  We note your suggestion on alternat\xe2\x80\xa6 https://t.co/qZ62OeNvJ3'
1049949090098896896,2018-10-10 09:05:44,"b'@vanessaseah Hi Vanessa, in developing these changes to the KrisFlyer programme, we took into consideration suggest\xe2\x80\xa6 https://t.co/iX6ycoH2GA'"
1049903029477101568,2018-10-10 06:02:43,"b""@wazzer1976 Hi Warren, we're very glad to hear this. We're very happy to know that your mother enjoyed herself. We\xe2\x80\xa6 https://t.co/FkNvHPcP2K"""
1049902488604864517,2018-10-10 06:00:34,"b'@dustinreed Hi Dustin, you may also contact your nearest Singapore Airlines office via https://t.co/3ZuTgoRhmG for\xe2\x80\xa6 https://t.co/VPYuUeOxrL'"
1049901794581770240,2018-10-10 05:57:48,"b'@JevdetOrgen Hi Jevdet, we have informed our colleagues looking into your case. They will get back to you as soon as they can. Thank you.'"
1049881607895699456,2018-10-10 04:37:35,"b'@kaartikgupta Hi Kartik, thank you for your feedback. We will be sure to announce it publicly if we decide to do so. Do stay tuned.'"
1049862698836602881,2018-10-10 03:22:27,"b'@HemaPatel We are sorry to hear this and we appreciate you sharing your feedback with us, Hema. We hope your next j\xe2\x80\xa6 https://t.co/8OhvBt6qbu'"
1049861829382549504,2018-10-10 03:19:00,"b""@miffSC We're very glad to hear of your experience. We look forward to welcoming you on board again soon :)"""
1049860776389959681,2018-10-10 03:14:49,b'@mediaanswers We wish you a pleasant journey ahead :)'
1049860018097586177,2018-10-10 03:11:48,"b'@BenniPosenov Hi there, we have informed our colleagues handling your case, of your concerns for them to look into. Thank you.'"
1049820644580442114,2018-10-10 00:35:21,"b'@Drakecula_crdl Thank you for clarifying, Jess. Should you require any direct booking assistance, please feel free\xe2\x80\xa6 https://t.co/Ffif51OPwo'"
1049819584067440642,2018-10-10 00:31:08,"b""@BenniPosenov Hi BP, we're sorry to hear about how you feel. May we seek your case reference number via sq_social@s\xe2\x80\xa6 https://t.co/I8udqqywZs"""
1049818154287935493,2018-10-10 00:25:27,"b'@Drakecula_crdl Hi Jess, thank you for your query. May we know if you currently seek booking assistance regarding y\xe2\x80\xa6 https://t.co/hHkp6sAUeo'"
1049809737074823168,2018-10-09 23:52:00,"b'@AMITSHA18947506 Hi Amit, thank you for the details. Could you please forward the previously corresponded emails to\xe2\x80\xa6 https://t.co/kfH2aROvmL'"
1049800460599783424,2018-10-09 23:15:08,"b""@jaysoncinense Hi Jayson, if you're planning to visit the stopover city, your luggage will not go straight through\xe2\x80\xa6 https://t.co/eqWJRv9lV7"""
1049793175467032578,2018-10-09 22:46:11,"b'@harmony2828 Hi there, thank you for your kind words and support. We will strive to ensure that we remain a great way to fly! \xf0\x9f\x98\x8a'"
1049792202459832322,2018-10-09 22:42:19,"b'@jaysoncinense Hi Jayson, may we know more details to your flight route? Thank you.'"
1049780421641363456,2018-10-09 21:55:31,"b'@jaysoncinense Hi Jayson, you should be able to leave the airport as long as you have the valid travel documents fo\xe2\x80\xa6 https://t.co/1EiFmF1XhM'"
1049777103284121600,2018-10-09 21:42:19,"b'@sthlaker We wish you a pleasant flight with us, David! \xf0\x9f\x98\x8a'"
1049776676849283072,2018-10-09 21:40:38,"b""@brittaniagirl Hi Lisa, we're sorry to hear this. May we know the nature of your concern? Thank you."""
1049767221055160320,2018-10-09 21:03:03,"b'@vanessaseah Hi Vanessa, if we may share, PPS Club members are not eligible for Elite Gold Rewards. You may wish to\xe2\x80\xa6 https://t.co/QhnlSKFUkQ'"
1049757787629203457,2018-10-09 20:25:34,"b'@tony_mottramuk We look forward to welcoming you onboard in the near future, Tony!'"
1049729292396089345,2018-10-09 18:32:20,"b""@romajoshi Hi there, we're sorry to hear about this. May we seek more details on this via sq_social@singaporeair.co\xe2\x80\xa6 https://t.co/27xuW4P0b4"""
1049724560415870978,2018-10-09 18:13:32,"b""@rmnward Hi Melanie, thank you for sharing your experience! As we'd like to relay your kind words to the crew invol\xe2\x80\xa6 https://t.co/We6d7EYCe1"""
1049704794426888192,2018-10-09 16:55:00,"b'@wiliam193 Hi there, thank you for clarifying. If we may share, redemption discount applies strictly to the flights\xe2\x80\xa6 https://t.co/7U86ZR7pED'"
1049702574180495360,2018-10-09 16:46:10,"b""@sophj9219 Hi Sophie, we're sorry to hear this. If we may share, your feedback is currently under review. You will\xe2\x80\xa6 https://t.co/YAQeNM2YPL"""
1049699047118958592,2018-10-09 16:32:09,"b""@aNr1857 We're sorry to hear this, Aniruddha. May we seek your booking reference number, seat number, and contact d\xe2\x80\xa6 https://t.co/w6l0g4IbhX"""
1049698814259593222,2018-10-09 16:31:14,"b'@wiliam193 Hi there, for clarification purposes, may we know which link you are referring to? Thank you.'"
1049687857433141248,2018-10-09 15:47:42,"b'@Nakkiran Hi there, we have received your email and we will respond accordingly. Thank you.'"
1049681058416001024,2018-10-09 15:20:41,"b'@Nakkiran Hi there, thank you for sharing the details. May we seek your booking reference number and contact detail\xe2\x80\xa6 https://t.co/omWNLkUXp7'"
1049680118078148608,2018-10-09 15:16:56,"b'@elrealblancos Hi Linny, you may wish to contact Eva Air directly regarding your query on their loyalty programme.\xe2\x80\xa6 https://t.co/wO7V4TEDgZ'"
1049667180252581888,2018-10-09 14:25:32,"b""@Nakkiran Hi there, we're sorry to hear about how you feel. May we know more details of your concern? Thank you."""
1049659924496703491,2018-10-09 13:56:42,"b'@Enrique77W Hi Enrique, we have received your email and will respond to it accordingly. Thank you.'"
1049653681057144832,2018-10-09 13:31:53,"b""@Enrique77W Hi Enrique, we're sorry to hear about this. May we seek your wife's booking reference number, seat numb\xe2\x80\xa6 https://t.co/zgZ7BX9d5S"""
1049644201313484800,2018-10-09 12:54:13,"b'@DavidMrsheen We look forward to welcoming you onboard, David. \xf0\x9f\x98\x8a'"
1049614023375970304,2018-10-09 10:54:18,"b'@derbytrim Happy to hear this, John :)'"
1049613783717564417,2018-10-09 10:53:21,"b""@PoloBearings Hi, we've responded to your earlier tweets."""
1049610607387914240,2018-10-09 10:40:44,"b'@egcosgrave Hi Elinor, you may email your booking reference number to us at SQ_Social@singaporeair.com.sg for us to follow-up accordingly :)'"
1049609442088640517,2018-10-09 10:36:06,"b'@HKTuff Hi Ben, thank you for your feedback. May we request for your flight, booking reference and seat numbers via\xe2\x80\xa6 https://t.co/PayV9og28q'"
1049606158418399232,2018-10-09 10:23:03,"b'@JevdetOrgen @SingaporeAirID Hi Jevdet, we are not able to DM. You may instead, email us your booking reference num\xe2\x80\xa6 https://t.co/uAGmiTELPw'"
1049602310006087680,2018-10-09 10:07:46,"b""@JevdetOrgen @SingaporeAirID Hi Jevdet, our staff's priority is to locate all lost luggage as soon as possible, reg\xe2\x80\xa6 https://t.co/lgEmlzEfbg"""
1049601470604165120,2018-10-09 10:04:25,"b'@shef_stef Sorry to hear this, Stefanie. Please share your booking reference number and contact details via SQ_Soci\xe2\x80\xa6 https://t.co/nlgQlaJzVK'"
1049600479456649220,2018-10-09 10:00:29,b'@hamachi_sushi__ Thank you for your kind words and support. We hope to see you again soon :)'
1049595118540472320,2018-10-09 09:39:11,"b'@JevdetOrgen @SingaporeAirID Hi Jevdet, our staff will do their best to help in the tracing efforts. Thank you for\xe2\x80\xa6 https://t.co/UN2Kpdaqfw'"
1049587092643295232,2018-10-09 09:07:17,"b'@Joolz152 Thank you, Julie \xf0\x9f\x98\x8a'"
1049578038172811264,2018-10-09 08:31:19,"b'@AdityaDimasP How was it, Aditya? :)'"
1049577298800852992,2018-10-09 08:28:22,"b'@beckyrosecarver Hi Becky, thank you for your query. We would like to share that payment must be made in full at the point of booking.'"
1049576963734679552,2018-10-09 08:27:03,"b'@egcosgrave We hope you will enjoy your honeymoon, Elinor! Would you like us to see if we can arrange a honeymoon c\xe2\x80\xa6 https://t.co/E0DaHABYL8'"
1049570421522276352,2018-10-09 08:01:03,b'You know your vacation has already started the moment you are greeted by our crew while boarding the aircraft.\xe2\x80\xa6 https://t.co/S8hBNPEIQR'
1049558220338069505,2018-10-09 07:12:34,"b'@JevdetOrgen @SingaporeAirID Hi Jevdet, may we know if you have already lodged a report about this matter to our DP\xe2\x80\xa6 https://t.co/dAYmzWxFD1'"
1049557822332133377,2018-10-09 07:10:59,"b""@troydean We're very pleased to hear this, Troy! Thank you for flying with us and we hope to see you again soon :)"""
1049536089281765377,2018-10-09 05:44:37,"b""@lclarke88 Hi Lily, we've been monitoring our inbox and have yet to receive your email. May we confirm that you hav\xe2\x80\xa6 https://t.co/4wYjIyEc0l"""
1049534835662950401,2018-10-09 05:39:38,"b'@TheBIGCafeteria Dear Adam, thank you for your feedback, which we have shared with our colleagues in the relevant department.'"
1049516382981894144,2018-10-09 04:26:19,"b'@lclarke88 Hi Lily, we will follow-up accordingly once we receive your email, thank you.'"
1049509812957077504,2018-10-09 04:00:13,"b'@lclarke88 Hi Lily, sorry to hear this. Please email your booking reference number and contact details to SQ_Social\xe2\x80\xa6 https://t.co/ZJreaXapU9'"
1049451222707687425,2018-10-09 00:07:24,"b""@BenParker90 Hi Ben, sorry to learn about this. If this is occurring on a flight you're currently on, do kindly app\xe2\x80\xa6 https://t.co/dAwypeYCk1"""
1049450831911800832,2018-10-09 00:05:50,"b'@ash_melburn Hi there, do kindly get in touch with your nearest Singapore Airlines office, where our reservations t\xe2\x80\xa6 https://t.co/bIOqNSmKTV'"
1049445147468025862,2018-10-08 23:43:15,b'@Fara7Pirlo local authorities who will be best able to advise on such matters: https://t.co/bdHoT12Fik. Thank you. (2/2)'
1049445065725288448,2018-10-08 23:42:56,"b'@Fara7Pirlo Hi, thank you for your reply. Passengers transiting through Singapore will not require a visa as long a\xe2\x80\xa6 https://t.co/0DgN2jy6fI'"
1049435930044653568,2018-10-08 23:06:37,"b'@d3Cryp10 Hi, please be assured that our staff and crew will be on hand to assist passengers throughout their journ\xe2\x80\xa6 https://t.co/DGOZJXMAsh'"
1049421946725814273,2018-10-08 22:11:04,"b'@Jai_Davies We look forward to welcoming you onboard, Jai! :)'"
1049407959342751746,2018-10-08 21:15:29,"b'@amilaik We wish you a pleasant flight, Amila! :)'"
1049374661430202369,2018-10-08 19:03:10,"b'@RS_MK Hi Rob, passengers travelling in Premium Economy class will also need to have the applicable frequent flyer\xe2\x80\xa6 https://t.co/A24gwukZVb'"
1049364945434005504,2018-10-08 18:24:33,"b'@aNr1857 Hi Aniruddha, sorry to hear about this. We apologise for any inconvenience caused due to the delay, and we\xe2\x80\xa6 https://t.co/nf1TJP73aW'"
1049364020795506690,2018-10-08 18:20:53,b'@ALifeWellDrunk We wish you a pleasant flight! :)'
1049350785644093441,2018-10-08 17:28:17,"b'@MattBellAD Hi Matt, we regret that we are not able to advise differently. That said, if you require any assistance\xe2\x80\xa6 https://t.co/MZs9wgpPZ8'"
1049344575813373955,2018-10-08 17:03:37,"b'@MattBellAD Hi Matt, if we may share, retroactive mileage claims that are made prior to enrolment in KrisFlyer must\xe2\x80\xa6 https://t.co/Vnw74SkydG'"
1049332697523523589,2018-10-08 16:16:25,"b'@SuzSinden Hi Suzanne, thank you for reaching out to us. May we clarify if you have since managed to get in touch w\xe2\x80\xa6 https://t.co/YqcUtresPx'"
1049317653612056576,2018-10-08 15:16:38,"b'@akshatratanpal @silkair Hi Akshat, thank you for reaching out to us. If we may share, special meals such as vegeta\xe2\x80\xa6 https://t.co/4dOwivNxIB'"
1049303828741480448,2018-10-08 14:21:42,"b'@ngauta Hi, thank you for your feedback. While we currently have no plans to operate flights to either of those cit\xe2\x80\xa6 https://t.co/L9Jal5HuN2'"
1049302955164389376,2018-10-08 14:18:14,"b'@rhyswesley Hi, thank you for your feedback. While we currently do not offer such a scheme, if you would like to fi\xe2\x80\xa6 https://t.co/6HzFuYXIAj'"
1049280079136743424,2018-10-08 12:47:20,"b'@saefarq Hi Andrew, thank you for clarifying. Could you please forward the corresponding emails with SilkAir, your\xe2\x80\xa6 https://t.co/hVA89eYIl6'"
1049279433838907392,2018-10-08 12:44:46,"b'@andy_dunleavy Hi Andy, we have checked and your flight, SQ322/08NOV18, does not have an upper deck Economy Class.\xe2\x80\xa6 https://t.co/5KEMbQoc8n'"
1049277749284798465,2018-10-08 12:38:04,"b'@krw8s Hi there, you may wish to forward the email to sq_social@singaporeair.com.sg should you seek further assista\xe2\x80\xa6 https://t.co/QeXsRYVeaO'"
1049271413830569984,2018-10-08 12:12:54,"b'@saefarq Hi Andrew, may we know what was last advised to you by the SilkAir staff when your flight was ""cancelled a\xe2\x80\xa6 https://t.co/AJGaSW0EVs'"
1049250451353419777,2018-10-08 10:49:36,"b""@saefarq Hi, we're sorry to hear this. We seek ur understanding that the operating airline responsible for the orig\xe2\x80\xa6 https://t.co/54KupCFLeI"""
1049244822098391041,2018-10-08 10:27:14,"b'@Nyanthegod Hi there, may we know more details of your concern? Thank you.'"
1049244475023941632,2018-10-08 10:25:51,"b'@krw8s Hi there, sorry to hear this. May we seek more details on this, alongside your booking reference number and\xe2\x80\xa6 https://t.co/rwXUNO4Uga'"
1049243905336721408,2018-10-08 10:23:35,"b'@saefarq Hi there, we currently do not have a DM function. May we know the nature of your concern? Thank you.'"
1049225492270919680,2018-10-08 09:10:25,"b'@fullerdada Hi Wendy, thank you for your reply. Would you like us to look into inserting a Birthday Cake request fo\xe2\x80\xa6 https://t.co/VUrT0klG13'"
1049213332228661248,2018-10-08 08:22:06,"b'@jennife12607308 Thank you for clarifying, Jennifer. Please do delete this tweet of yours as it contains your booki\xe2\x80\xa6 https://t.co/I60kvfE66w'"
1049210432190406656,2018-10-08 08:10:35,"b""@fullerdada Hi Wendy, we're delighted to hear this! May we know if your birthday falls on the same date as your flight with us? Thank you."""
1049208036949151744,2018-10-08 08:01:04,"b""We are honoured to be on TIME's inaugural list of 50 Most Genius Companies! Find out more here:\xe2\x80\xa6 https://t.co/T7qded7g7R"""
1049207971836829697,2018-10-08 08:00:48,"b""@jennife12607308 Hi Jennifer, we're sorry to hear this. May we know which email/person did you last corresponded wi\xe2\x80\xa6 https://t.co/grlshYpGvg"""
1049203891378769920,2018-10-08 07:44:35,"b'@Amandee51277466 Hi Amandeep, thank you for your feedback and suggestion. We will be sure to announce if there are\xe2\x80\xa6 https://t.co/rS2muZSdjX'"
1049197560244711424,2018-10-08 07:19:26,"b'@janicedevinaa Hi Janice, yes, Singapore Airlines passengers may check-in the day before their flight from Hong Kon\xe2\x80\xa6 https://t.co/UxUcdqjG9i'"
1049196169740673025,2018-10-08 07:13:54,"b'@sob80sup81 Hi there, thank you for reaching out to us. May we know if you encountered any error message whilst try\xe2\x80\xa6 https://t.co/WxOSsJsVc7'"
