id,created_at,text
1042822117992083456,2018-09-20 17:05:42,"b""@AmritWijesuriya Hi Amrit, we're sorry to hear this. May we know if this is regarding a recent flight with us? Thank you."""
1042820443084922880,2018-09-20 16:59:02,"b'@Sarah_Nicho Thank you for your kind words, Sarah, and we will relay your compliments to the crew involved. We wish\xe2\x80\xa6 https://t.co/Xnji15VfNu'"
1042819266872004609,2018-09-20 16:54:22,"b'@mac_lee Hi there, for paid and confirmed upgrades, do contact your nearest SIA office: https://t.co/3ZuTgoRhmG \nfo\xe2\x80\xa6 https://t.co/KR0iSuhWnW'"
1042788973100318721,2018-09-20 14:53:59,"b'@ianchan79 Hi Ian, online/mobile check-in will be open from 48 hours to 1.5 hours before your flight departs. Do cl\xe2\x80\xa6 https://t.co/HQtyBOunB1'"
1042788355677855746,2018-09-20 14:51:32,"b""@ZachHonig Thank you for sharing, Zach, and we look forward to welcoming you onboard in three weeks' time! \xf0\x9f\x98\x8a"""
1042753961260924930,2018-09-20 12:34:52,"b'@shandelsam Thank you for the clarification, Samantha. You may wish to continue liaising with your travel agency as\xe2\x80\xa6 https://t.co/rfry33o58Y'"
1042752593624281089,2018-09-20 12:29:26,"b'@ying0329 Hi Ying, you may wish to clear your cache and browser history and try again. Do let us know if the problem persists. Thank you.'"
1042745702529609728,2018-09-20 12:02:03,"b'@shandelsam Hi Samantha, we are unable to view the link you have sent in your previous post. May we check if our ca\xe2\x80\xa6 https://t.co/UWGSg8i1u0'"
1042744315435524096,2018-09-20 11:56:32,"b'@rohanneets Hi Rohan, we have responded to your facebook post. Thank you.'"
1042618096496848897,2018-09-20 03:34:59,"b'@Dholfoundation Hi there, we are sorry to hear this. We appreciate your sharing your feedback with us for our impro\xe2\x80\xa6 https://t.co/roelmsi6r7'"
1042617688177160192,2018-09-20 03:33:22,"b'@johnnykalsi Hi Johnny, we are sorry to hear this and thank you for your feedback. May we check if you require any assistance?'"
1042586142938488832,2018-09-20 01:28:01,"b'@Hafild Dear Hafild, we are sorry to hear this. May we have a forward of the email you received and your contact de\xe2\x80\xa6 https://t.co/SGDrBNXruV'"
1042553274052870149,2018-09-19 23:17:24,"b""@theevilmuppet Hi Chris, the recheck counter staff should be in the best position to assist you, as it's their duty\xe2\x80\xa6 https://t.co/Hn5qfdhK01"""
1042536049405321216,2018-09-19 22:08:58,"b'@theevilmuppet Hi Chris, thank you for the info. You may wish to approach the recheck counter in IAH to see if the\xe2\x80\xa6 https://t.co/O3SFoaRMLy'"
1042528150784303106,2018-09-19 21:37:35,"b'@theevilmuppet Hi Chris, are you connecting from another airline to ours in IAH and looking to obtain our boarding\xe2\x80\xa6 https://t.co/I9WQ2e2lFy'"
1042526584807276544,2018-09-19 21:31:21,"b'@alohacindy Hi Cindy, you may wish to reach out to our KrisFlyer colleagues at KF_Contact@singaporeair.com.sg on this matter, thank you.'"
1042525246337822720,2018-09-19 21:26:02,"b'@LawlerAndrew We wish you a safe and comfortable journey back to Singapore, Andrew! :)'"
1042457397682466821,2018-09-19 16:56:26,"b'@ianchan79 Hi Ian, you can check in 3 hours before flight departure, as that will be when the counters open.'"
1042416724501508096,2018-09-19 14:14:48,"b'@terry12999 Hi Terence, we will share more details about this once confirmed, thank you.'"
1042413673753600000,2018-09-19 14:02:41,"b'@yngulfh May we suggest that you clear your browser cache and history, and try making the booking again, ensuring t\xe2\x80\xa6 https://t.co/VWo3YFM1BS'"
1042413595039031298,2018-09-19 14:02:22,"b'@yngulfh Hi there, our website is not currently undergoing any maintenance, and we do not have any current reports\xe2\x80\xa6 https://t.co/OsikWJGEbD'"
1042393822997762048,2018-09-19 12:43:48,"b'@terry12999 Hi Terence, may we know for which flight route or flight number are you enquiring for? Thank you for your query.'"
1042393025589248000,2018-09-19 12:40:38,"b'@monicarroy Hi Monica, thank you for clarifying. May we seek your e-ticket number, baggage report number and contac\xe2\x80\xa6 https://t.co/jUGkBXSIdl'"
1042388745620643843,2018-09-19 12:23:38,b'[TRAVEL ADVISORY UPDATE 7]\n\nSingapore Airlines flights to and from Osaka will resume normal operations on 21 Septem\xe2\x80\xa6 https://t.co/mBEBEDg1Vz'
1042373810778001408,2018-09-19 11:24:17,"b""@MatthewsDarren We're sorry to hear this, Darren. Do feel free to approach our cabin crew should you require any di\xe2\x80\xa6 https://t.co/h0E5mDjikV"""
1042354703949078528,2018-09-19 10:08:22,"b""@monicarroy Hi Monica, we're sorry to hear about this. May we know the flight details (date and from which destinat\xe2\x80\xa6 https://t.co/sV3e9jSVZh"""
1042349899906535424,2018-09-19 09:49:16,"b'@jeffnunner Hi Jeff, we currently do not have  a DM function. While we do not give complimentary upgrades in view o\xe2\x80\xa6 https://t.co/yVWMZunoXW'"
1042348588947460096,2018-09-19 09:44:04,"b'@AshutoshRattan Thank you for your feedback, Ashutosh. You may wish to write in via: https://t.co/zgPxP7WGnx  on th\xe2\x80\xa6 https://t.co/M2aEtEcImr'"
1042337379661606913,2018-09-19 08:59:31,"b""@jeffnunner Hi Jeff, to better assist you, may we clarify what 'UA*S' stands for? Thank you."""
1042332732838346752,2018-09-19 08:41:03,"b""@AshutoshRattan Hi Ashutosh, we're sorry to hear this. May we seek more details of this concern to see how best to assist you? Thank you."""
1042308064886575104,2018-09-19 07:03:02,"b'@knottyshruti Hi Shruti, thank you for reaching out to us. If we may share, once your friend has made a report, ple\xe2\x80\xa6 https://t.co/tNdUkZxWT5'"
1042299612047069184,2018-09-19 06:29:27,"b""@averkiev We're sorry to hear this, Yury. We note on your feedback regarding our website. May we know if you curren\xe2\x80\xa6 https://t.co/s4Xilzrdh6"""
1042285960069885952,2018-09-19 05:35:12,"b'@stefankunz15 Hi Stefan, may we know more details of your concern to see how best to assist you? Thank you.'"
1042261092276285441,2018-09-19 03:56:23,"b""@everydaycook Hi there, we're sorry to hear this. Could you please forward your sent feedback to sq_social@singapor\xe2\x80\xa6 https://t.co/BtFqpW1Xcd"""
1042260025731964930,2018-09-19 03:52:09,"b""@moulircm Hi Mouli, we're sorry to hear this and we have responded to your initial tweet on this, thank you."""
1042259627512156160,2018-09-19 03:50:34,"b""@moulircm Hi Mouli, we're sorry to hear about how you feel. We regret that we're unable to advise you differently f\xe2\x80\xa6 https://t.co/Qjzg4KDNNm"""
1042222751791099904,2018-09-19 01:24:02,"b'@ScottJAw Glad to be of assistance, Scott. :)'"
1042211670532206592,2018-09-19 00:40:00,"b""@ScottJAw Hi Scott, we're glad you enjoyed your experience with us. If we may share, the Funko Pop! Singapore Girl\xe2\x80\xa6 https://t.co/JUmgTXWqkv"""
1042207949425442816,2018-09-19 00:25:13,"b'@hereisnewbie Hi, unfortunately, you will not be able to check-in your baggage any earlier than that. Thank you for your understanding.'"
1042194725468614656,2018-09-18 23:32:40,b'@kellyyyllek We wish you a pleasant flight! :)'
1042171457797844992,2018-09-18 22:00:12,"b'@charmaineque888 Hi Charmaine, noted and thank you for the update.'"
1042162218257854464,2018-09-18 21:23:29,"b'@MatthewsDarren Hi Darren, you should be able to locate our ground staff either at your gate, or at one of the tran\xe2\x80\xa6 https://t.co/Gov6mvKhHw'"
1042156957812105217,2018-09-18 21:02:35,"b'@MatthewsDarren Hi Darren, sorry to hear about your ankle. Do kindly get in touch with your nearest Singapore Airli\xe2\x80\xa6 https://t.co/XrVPZQJ9SY'"
1042155806773465090,2018-09-18 20:58:01,"b""@charmaineque888 Hi Charmaine, thank you for your reply, and we're sorry to hear about your baggage. If you have ye\xe2\x80\xa6 https://t.co/ufkWAQJshJ"""
1042150343906390021,2018-09-18 20:36:18,"b'@saianel Hi there, thank you for your reply, and we will highlight this to the relevant department. In the meantime\xe2\x80\xa6 https://t.co/bAJyvWGeRx'"
1042149330965159937,2018-09-18 20:32:17,"b'@WeibinHan Hi Weibin, as visa related matters are under the purview of the local authorities, you may wish to check\xe2\x80\xa6 https://t.co/ipgoIBKuQ4'"
1042148789291823105,2018-09-18 20:30:08,"b'@cathryn_101 Hi Cathryn, you may wish to get in touch with your nearest Singapore Airlines office for further assis\xe2\x80\xa6 https://t.co/CruMKunaFT'"
1042143631564591105,2018-09-18 20:09:38,"b'@saianel Hi there, thank you for reaching out to us. May we clarify which flight number you are attempting to select a seat for?'"
1042111780498141185,2018-09-18 18:03:04,"b'@charmaineque888 Hi Charmaine, thank you for reaching out to us. May we clarify what occurred and what your concern\xe2\x80\xa6 https://t.co/g55BB4mmlL'"
1042067987749068801,2018-09-18 15:09:03,"b'@hereisnewbie Hi, thank you for your patience while we checked. Please be advised that for departure from Jakarta,\xe2\x80\xa6 https://t.co/xg8OtLKijn'"
1042067114939568128,2018-09-18 15:05:35,"b'@raissarenata Hi, thank you for your reply. You may wish to get in touch with our 24hr contact centre (+65 6223 888\xe2\x80\xa6 https://t.co/srCWe1Zyfn'"
1042060920334299136,2018-09-18 14:40:58,"b'@raissarenata Hi, thk u for reaching out to us. Customers shld be able to cancel their online check-in via the chec\xe2\x80\xa6 https://t.co/IGC5jOH91m'"
1042056972445667329,2018-09-18 14:25:17,"b'@hereisnewbie Hi, thank you for your reply. Do let us check with the relevant department and we will get back to yo\xe2\x80\xa6 https://t.co/mDTXnpTBxb'"
1042055728696053760,2018-09-18 14:20:20,"b'@hamburg851 Hi there, thank you for reaching out to us. May we seek more details on your enquiry so we can see how\xe2\x80\xa6 https://t.co/SbcWZOm5OC'"
1042047746373574657,2018-09-18 13:48:37,"b""@RaMi67723671 We're glad to hear that you enjoyed your experience! :)"""
1042047081387642895,2018-09-18 13:45:59,"b'@hereisnewbie Hi, may we clarify which city you will be departing from? Thank you.'"
1042010846300463107,2018-09-18 11:22:00,"b'@anakpanti Hi Anakpanti, you may wish to view our guidelines on lithium batteries, to determine if you can bring it\xe2\x80\xa6 https://t.co/ttGSaPoihz'"
1042006922315137025,2018-09-18 11:06:24,"b'@aheadless Hi Andrew, may we know the error message you have encountered or issue that you faced? Thank you.'"
1041974411711184896,2018-09-18 08:57:13,"b'@AviaJaden Hi, flight fares are mainly subjected to demand. Naturally if demand is high, the prices will surge as a\xe2\x80\xa6 https://t.co/OKvT8gc0yQ'"
1041968645075873792,2018-09-18 08:34:18,"b'@a_sandy Hi Agustinus, you may wish to contact your local baggage office to make a report. Contact info can be foun\xe2\x80\xa6 https://t.co/vNZu2BcBAB'"
1041938039071752192,2018-09-18 06:32:41,"b'@selie Hi Selie, sorry to hear that. Please email your booking ref to sq_social@singaporeair.com.sg and we will sha\xe2\x80\xa6 https://t.co/xQ8GZ5Usk6'"
1041930274710466562,2018-09-18 06:01:50,"b'@sandeepbaliga Hi there, there are currently no restrictions and customers may bring the Note 9 onboard. Thank you.'"
1041923810436505606,2018-09-18 05:36:09,"b'@adhi_susantio Hi Adhi, you may wish to contact the baggage department to make a report. The email address is ams.m\xe2\x80\xa6 https://t.co/ENzixP0W0r'"
1041854462229397505,2018-09-18 01:00:35,b'@itskeneh Nice. We look forward to welcoming you onboard again soon! :)'
1041848680234541056,2018-09-18 00:37:36,"b""@itskeneh Thank you for sharing, Kene'h. We trust that was a scream of delight? :) Glad to hear you are enjoying the flight!"""
1041839466636345344,2018-09-18 00:00:59,"b'@yongkimilanda Hi there, our various promotional fares come with different terms and conditions; some may have a ma\xe2\x80\xa6 https://t.co/frfQaDUUff'"
1041838638621974528,2018-09-17 23:57:42,"b'@jdrama68 Hi Johnny, yes, perhaps you may wish to try again in late December or January as it may be a little early at this stage.'"
1041826487639441410,2018-09-17 23:09:25,"b'@jdrama68 Hi Johnny, may we know which date your flight is departing? Do you receive an error message when trying to book the cook?'"
1041825979323301889,2018-09-17 23:07:24,"b'@adhi_susantio Hi Adhi, may we clarify if you are in Amsterdam now?'"
1041825387888685056,2018-09-17 23:05:03,"b""@LawlerAndrew We hope you're having a pleasant flight, Andrew :)"""
1041825016294400001,2018-09-17 23:03:34,"b'@CindyStarfall Looks like you had a great time onboard, Cindy! Thank you for your kind words :)'"
1041725695351824384,2018-09-17 16:28:54,"b""@tully_b If you'd like, you can share the details including your booking reference number and flight details via em\xe2\x80\xa6 https://t.co/CoOYMprtiE"""
1041704525634174977,2018-09-17 15:04:47,b'@tully_b Sorry to hear this. Would you like to share why?'
1041704285648707586,2018-09-17 15:03:50,"b'@chawla_ramesh Hi there, if you are referring to Changi Airport, you may wish to have a look at its career page her\xe2\x80\xa6 https://t.co/Ab3GB3Gytz'"
1041689702775054336,2018-09-17 14:05:53,"b""[TRAVEL ADVISORIES UPDATE 6] \n\nOsaka's Kansai International Airport expected to resume full operations on 21 Septem\xe2\x80\xa6 https://t.co/HEzsWElA07"""
1041677423828520960,2018-09-17 13:17:05,"b'@AndrewOpenshaw Sorry to hear this, Andy. May we know if the counter staff were able to find out and explain why th\xe2\x80\xa6 https://t.co/6nTK5KBdgC'"
1041668063266066433,2018-09-17 12:39:54,"b'@i0n1c Hi Stefan, thank you for your feedback, and we will share it with the relevant department for their review.\xe2\x80\xa6 https://t.co/atTysc2yvh'"
1041656443026513920,2018-09-17 11:53:43,"b'@mark_olweny Hi Mark, if we may share, the contact details of our various reservations office can be found on our w\xe2\x80\xa6 https://t.co/EWIa05PbCF'"
1041630648098848768,2018-09-17 10:11:13,"b'@Captain_Jack24 Hi, if we may share, we do operate flights between Singapore and Maldives. Do visit our website (\xe2\x80\xa6 https://t.co/Hbdafq6bfn'"
1041629906348777473,2018-09-17 10:08:16,"b'@kam82 Hi there, thank you for reaching out to us. If we may share, customers can share their feedback and concerns\xe2\x80\xa6 https://t.co/n1a9HyLMyM'"
1041629321427922944,2018-09-17 10:05:57,"b'@jontweetshere Hi Jonathan, we have noted your feedback and thank you for sharing it with us. Should you have any q\xe2\x80\xa6 https://t.co/nRxZyZ22qV'"
1041627763789254656,2018-09-17 09:59:46,"b'@jhender Hi, our sister airline, Scoot, does operate flights between Singapore and Athens. For more information on\xe2\x80\xa6 https://t.co/KMtM98tIlj'"
1041601254122766336,2018-09-17 08:14:25,"b'@IMShashankMehta Hi Shashank, we have received your email and have shared it with the relevant department for their\xe2\x80\xa6 https://t.co/lSjah1g7Ub'"
1041597920376705029,2018-09-17 08:01:10,b'Where is your favourite beach destination? #FlySQ https://t.co/wuUBI1NSkH'
1041573292300279808,2018-09-17 06:23:19,"b'@mani2209 Hi Manish, thank you for your patience while we checked. Please be advised that the above item must be ch\xe2\x80\xa6 https://t.co/RmQIkXIl0T'"
1041572311097389057,2018-09-17 06:19:25,"b'@adhi_susantio Hi Adhi, thank you for reaching out to us. May we clarify if you have already filed a baggage report\xe2\x80\xa6 https://t.co/VqSZwwavM3'"
1041528078713929728,2018-09-17 03:23:39,"b'@mani2209 Hi Manish, do let us check with the relevant department on this, and we will get back to you as soon as we can. Thank you.'"
1041524595726139392,2018-09-17 03:09:48,"b'@mani2209 Hi Manish, may we clarify which city you will be departing from, as well as your destination city? Thank you.'"
1041494589344030721,2018-09-17 01:10:34,"b'@petemumby Thank you for your feedback, Peter. We seek your understanding that while we are not able to make any ch\xe2\x80\xa6 https://t.co/OhvMafcDCL'"
1041493781919531008,2018-09-17 01:07:22,"b'@viineet Thanks for sharing this with us, Vineet, and we hope you enjoyed the impromptu celebration onboard! :)'"
1041402773093470208,2018-09-16 19:05:44,"b'@Niels505 No worries, Niels, we wish you a pleasant flight with us! \xf0\x9f\x98\x8a'"
1041398186265468928,2018-09-16 18:47:30,"b""@Niels505 Hi Niels, if we're your first carrier and your layover in SIN is less than 24h (and you're not planning t\xe2\x80\xa6 https://t.co/hmbKNCgNba"""
1041383562707120130,2018-09-16 17:49:23,"b'@Niels505 Hi Niels, may we clarify if these flights are under the same booking ref number? Also, the baggage allowa\xe2\x80\xa6 https://t.co/2HAR8AI940'"
1041371082698186752,2018-09-16 16:59:48,"b'@rosie_corbett Hi Rosie, if we may share, we do not give free upgrades in view of our customers who pay a premium t\xe2\x80\xa6 https://t.co/ftJZgSAW7N'"
1041354348184436737,2018-09-16 15:53:18,"b""@jimscorpy Hi Jimmy, we're sorry to hear this. May we know if you have received your baggage? Thank you."""
1041338286525038593,2018-09-16 14:49:29,"b'@cayman1001 Hi Cayman, SQ001/17SEP18 will depart as scheduled. Do update your contact details or subscribe to a mob\xe2\x80\xa6 https://t.co/Tht2UJyZk8'"
1041336216501673984,2018-09-16 14:41:15,"b'Congratulations to #LewisHamilton, #MaxVerstappen and #SebastianVettel! See everyone next year! https://t.co/xBnBYsVtAb'"
1041331388740501504,2018-09-16 14:22:04,"b'@Groozie1 Hi Christopher, SQ001/16SEP18 will arrive at Hong Kong SAR (HKG) from San Francisco (SFO) at 06:03 - 17 S\xe2\x80\xa6 https://t.co/NHrKUnOzb7'"
1041327962904096769,2018-09-16 14:08:27,"b""[TRAVEL ADVISORIES UPDATE 5]\n\nOsaka's Kansai International Airport expected to resume full operations on 21 Septemb\xe2\x80\xa6 https://t.co/ZBeZD4XIhK"""
1041305961011589120,2018-09-16 12:41:02,"b'@jdeamattson Sorry to hear this, Jordan. Is this for an upcoming flight, or one that has just passed?'"
1041304163806793728,2018-09-16 12:33:53,"b""@Bigh340 Wonderful! Do share your booking reference number with us via email at SQ_Social@singaporeair.com.sg and we'll look into it :)"""
1041299141907894272,2018-09-16 12:13:56,"b'@IMShashankMehta May we seek your booking reference number, seat and flight number and contact details via SQ_Socia\xe2\x80\xa6 https://t.co/xCUjF2AJR4'"
1041298546027360256,2018-09-16 12:11:34,"b'@Jeffayn Hi Lee, may we seek your booking reference number and a photo of the front passport page for each travelle\xe2\x80\xa6 https://t.co/A6zX2bJ3uq'"
1041297248389406720,2018-09-16 12:06:25,b'@Bigh340 Congratulations to both on this happy occasion! We may not be able to promise an upgrade but we can look i\xe2\x80\xa6 https://t.co/gGshPskZlC'
1041296103143034881,2018-09-16 12:01:51,"b'@andryramana Sorry to hear this, Andry. We are working on improving the performance of our website. In the meantime\xe2\x80\xa6 https://t.co/OsPu21Zu2I'"
1041295417101578240,2018-09-16 11:59:08,"b'RT @F1NightRace: Down on the grid, the atmosphere is just incredible! Absolutely electric!\n#Formula1 #F1 #SingaporeGP https://t.co/IK1EL6Ep\xe2\x80\xa6'"
1041295375351590919,2018-09-16 11:58:58,"b'@scionavarielle Thank you for clarifying, Maria. Did you have the opportunity to ask for snacks from our crew onboa\xe2\x80\xa6 https://t.co/TTEuk3YqGd'"
1041246674851647488,2018-09-16 08:45:27,"b'@IMShashankMehta Sorry to hear this, Shashank. For clarity, may we know what you meant by ""NVeg"" - were you referri\xe2\x80\xa6 https://t.co/mmLpylPTUk'"
1041246234206453760,2018-09-16 08:43:42,"b'@KapilDu47138778 However, you may wish to make a regular booking on our website home page under ""Book a trip"" and v\xe2\x80\xa6 https://t.co/fzHg9zblcC'"
1041246168142028800,2018-09-16 08:43:26,"b'@KapilDu47138778 Hi Kapil, thanks for sharing. As the terms of the promotion state that the maximum stay is one mon\xe2\x80\xa6 https://t.co/oTA2HDO66f'"
1041244501191340037,2018-09-16 08:36:49,b'@siva_shanmug May we seek the following details via email at SQ_Social@singaporeair.com.sg: booking reference numbe\xe2\x80\xa6 https://t.co/W3gJyrEsdo'
1041244438427852807,2018-09-16 08:36:34,"b""@siva_shanmug Hi Shanmug, we'd like to ask our customer feedback colleagues to review your concerns for follow-up with you. (1/2)"""
1041242878079651840,2018-09-16 08:30:22,"b'@xdmatt Dear Matthew, please email your booking reference number and contact details to SQ_Social@singaporeair.com.\xe2\x80\xa6 https://t.co/uwGhW48klb'"
1041237579818041344,2018-09-16 08:09:18,"b'@KapilDu47138778 Hi Kapil, would you be able to provide us the link to the fare promotion page so that we are bette\xe2\x80\xa6 https://t.co/juNBSICO24'"
1041236272579313664,2018-09-16 08:04:07,"b'@rrahulmehta Having said this, we are sorry to hear of how our customer service has responded to you. If you would\xe2\x80\xa6 https://t.co/mqg2RfNgYq'"
1041236211669651456,2018-09-16 08:03:52,"b'@rrahulmehta Hi Rahul, we would like to share that we do not provide complimentary upgrades, and early seat allocat\xe2\x80\xa6 https://t.co/bmAIgYZLK0'"
1041223223394926593,2018-09-16 07:12:16,"b""[TRAVEL ADVISORIES UPDATE 4]\n\nOsaka's Kansai International Airport expected to resume full operations on 21 Septemb\xe2\x80\xa6 https://t.co/EiAWI9WILP"""
1041220171346706433,2018-09-16 07:00:08,"b""@Caithan Additionally, we'd advise that you remove or crop the photo in your tweet as it shows the booking referenc\xe2\x80\xa6 https://t.co/pvaj2IkCyR"""
1041220096268619776,2018-09-16 06:59:50,"b'@Caithan Hi Caitlin, please email your contact number to SQ_Social@singaporeair.com.sg along with a photo of your h\xe2\x80\xa6 https://t.co/kpnfoXxpK7'"
1041207039207395328,2018-09-16 06:07:57,"b'@scionavarielle Dear Maria, may we seek your booking reference number and contact details via email at SQ_Social@si\xe2\x80\xa6 https://t.co/PC377lcjvJ'"
1041203694732275712,2018-09-16 05:54:40,"b'@ibarra1213 Hi Ibarra, we provide in-flight entertainment onboard all our flights, in every cabin.'"
1041203387876950016,2018-09-16 05:53:26,"b'@Caithan Hi Caitlin, was there any error message received when your husband tried to check-in online? Thank you.'"
1041195627743457280,2018-09-16 05:22:36,"b'@Bintang140490 Hi Bintang, at the moment that flight is on schedule, but please continue to stay tuned to our websi\xe2\x80\xa6 https://t.co/6q3hvElXRn'"
1041178711620562944,2018-09-16 04:15:23,"b'@Bintang140490 Hi Bintang, may we confirm your flight date and flight number?'"
1041177903361413120,2018-09-16 04:12:10,"b'@prakash4040 Thank you for your kind words, Prakash! :)'"
1041156002345889792,2018-09-16 02:45:09,"b'@Jeffayn Hi Lee, it means that there is a mismatch in how your first and/or last name is reflected in your passport\xe2\x80\xa6 https://t.co/ppQIcO7O8l'"
1041152128503504897,2018-09-16 02:29:45,b'@SupItsCat We hope you will enjoy both the airline and airport experience :)'
1041138308267606016,2018-09-16 01:34:50,"b'@ghchia93 Hi Ghee Hing, no problem - you can simply update your new passport information during check-in.'"
1041138058417106944,2018-09-16 01:33:51,"b'@PaoloFerrari__ Sorry to hear about the WiFi, Paolo. Please share the details with us, including your booking refer\xe2\x80\xa6 https://t.co/sqUaJAU5jK'"
1041085123091988480,2018-09-15 22:03:30,"b'@GomesTweet Hi, may we confirm if you have written in to us as suggested earlier or used the link given to share yo\xe2\x80\xa6 https://t.co/e2UUE33F6V'"
1041081258258956289,2018-09-15 21:48:08,"b'@siva_shanmug Hi Shanmug, sorry to hear that. May we know the nature of your enquiry please? Perhaps we can try to help. Thank you.'"
1041080812031107072,2018-09-15 21:46:22,b'@GomesTweet Sorry to hear that. Please let us know how we can improve the inflight meal by sharing your suggestion\xe2\x80\xa6 https://t.co/19j39Giyy6'
1041080432861827073,2018-09-15 21:44:52,"b""@ddos_mg Hi, in order to protect your privacy, we'd strongly suggest that you delete this tweet containing your boo\xe2\x80\xa6 https://t.co/FtuxsHvrbK"""
1041077884021100544,2018-09-15 21:34:44,"b'@amienmz Hi there, yes that is correct. Thank you.'"
1041076840037842946,2018-09-15 21:30:35,"b'@ddos_mg Hi there, flight is still operating as per schedule. You may wish to update your contact details or subscr\xe2\x80\xa6 https://t.co/6dIUrewSb9'"
1041072354779029505,2018-09-15 21:12:46,"b'[TRAVEL ADVISORIES UPDATE 3]\n\nPlease click here for info about partial resumption of flights to/from Osaka, please\xe2\x80\xa6 https://t.co/IHh9NkoBSD'"
1041014869213044736,2018-09-15 17:24:20,"b""@amienmz Hi Rais, that's correct. A single piece of checked baggage should not exceed 32kg. You may check in 2 piec\xe2\x80\xa6 https://t.co/wSzayUIIDw"""
1041014378517213185,2018-09-15 17:22:23,"b'@suikaiwong Hi SK, please email your booking reference to sq_social@singaporeair.com.sg and we will look into it. Thank you.'"
1040971543029932035,2018-09-15 14:32:10,"b'@tamichanzz Hi Tammy, yes, that could be possible.'"
1040965266287546370,2018-09-15 14:07:14,"b'@tamichanzz Hi Tammy, you will need to choose miles during the bidding process as shown here. Thank you. https://t.co/weKLHv7QyV'"
1040947482665144322,2018-09-15 12:56:34,"b'@danish813 Hi Danish, thank you for the info. You do not need a transit visa in Singapore if you do not plan to exi\xe2\x80\xa6 https://t.co/Parxl3rAzH'"
1040944513605349377,2018-09-15 12:44:46,"b'@danish813 Hi Danish, may we know more details of your flight routes to better assist you? Thank you.'"
1040943936519450624,2018-09-15 12:42:28,"b'@IMShashankMehta Hi Shashank, if we may advise, you may wish to check your baggage in at Terminal 3 as your flight\xe2\x80\xa6 https://t.co/u9j5RVII2b'"
1040937695348965376,2018-09-15 12:17:40,"b""@wkeithg Hi there, we're sorry to hear about this. May we clarify if you currently seek booking assistance? Thank you."""
