id,created_at,text
1035534251452784641,2018-08-31 14:26:19,"b'@Greg_Frain Hi Greg, it could be due to a number of different reasons, which we are unable to specify. Thank you fo\xe2\x80\xa6 https://t.co/ZORM1nWpku'"
1035527872428032000,2018-08-31 14:00:58,"b""@MrsMKD1973 Hi, we'd suggest asking them to appeal on your behalf as they will have contact with a Singapore Airlin\xe2\x80\xa6 https://t.co/mDuf2C7XJh"""
1035524754495741953,2018-08-31 13:48:35,"b'@Greg_Frain Hi Greg, it is due to operational reasons. To protect your privacy, pls delete your tweet as it contain\xe2\x80\xa6 https://t.co/1tRPWCOHOl'"
1035504266339856385,2018-08-31 12:27:10,"b""@webding Hi Marc, we'd like to share that as our website works on a real-time basis, fares may go up or down depend\xe2\x80\xa6 https://t.co/ybBsyFgPq7"""
1035495714518970368,2018-08-31 11:53:11,"b'@seriouspalates Hi Terence, thank you for the information. Our staff will try their best to see if they can locate your tablet.'"
1035495311517601792,2018-08-31 11:51:35,"b""@GomesTweet Hi there, thank you for your query; unfortunately we're unable to confirm the drinks menu info for SQ21\xe2\x80\xa6 https://t.co/NbFk3vW0IK"""
1035493399313436673,2018-08-31 11:43:59,"b""@MrsMKD1973 Hi there, we'd like to share that for any bookings made with travel agents, the agents are responsible\xe2\x80\xa6 https://t.co/OG0ckr6hMI"""
1035492856826396673,2018-08-31 11:41:50,"b'@annienorthbooks Hi Annie, may we know if you have contacted our call centre about this and if so, what their explanation was? Thank you.'"
1035491341789274113,2018-08-31 11:35:49,"b""@ideveshchandel Hi Devesh, we've replied to your earlier tweet. We'd strongly advise that you do not post your trav\xe2\x80\xa6 https://t.co/04rjGUyBc0"""
1035490771389034496,2018-08-31 11:33:33,"b'@GomesTweet Hi there, we will convey your feedback to our caterers for consideration, thank you.'"
1035489880074272769,2018-08-31 11:30:00,"b""@ideveshchandel Hi Devesh, sorry to hear this but we'd like to share that Singapore Airlines does not operate fligh\xe2\x80\xa6 https://t.co/j6y1iJLoKj"""
1035445932412887040,2018-08-31 08:35:22,"b""@Brian_TCtravel You're welcome, Brian :)"""
1035439509935214592,2018-08-31 08:09:51,"b""@GomesTweet Regarding our wines and champagne, we'd like to share that they are not vegan. If you wish to bring you\xe2\x80\xa6 https://t.co/aoSiBHOaFh"""
1035439347531763712,2018-08-31 08:09:12,"b'@GomesTweet For the HKG lounge, we have multiple vegetarian options, but as the menu may be subject to change, you\xe2\x80\xa6 https://t.co/FTU0m5tHgB'"
1035439235908685824,2018-08-31 08:08:46,"b'@GomesTweet For the SIN lounge, our lounge colleagues are not able to confirm if they can arrange a vegan selection\xe2\x80\xa6 https://t.co/0ywCGw1wJt'"
1035439093340094464,2018-08-31 08:08:12,"b""@GomesTweet Hi there, we're sorry for the delay in reply. For the lounge in SYD, we have dishes that do not contain\xe2\x80\xa6 https://t.co/2SHzAFuK06"""
1035431610194305024,2018-08-31 07:38:27,"b""@iammichiewill That's reassuring for us to hear, Mich! Thank you for your compliments :)"""
1035431081577787393,2018-08-31 07:36:21,b'@royalshynesss Sorry to hear this. May we know if you have sought the assistance of our cabin crew onboard your fli\xe2\x80\xa6 https://t.co/HtlQ6T9Q7g'
1035430621919752192,2018-08-31 07:34:32,"b'@JessicaGottlieb Hi Jessica, if you are one of his redemption group nominees, he can use his KrisFlyer miles to boo\xe2\x80\xa6 https://t.co/yzAKdRxaZF'"
1035429995886325761,2018-08-31 07:32:03,"b'@dmconnors Hi Dave, sorry that we are not able to provide an upgrade, but if you need any assistance during your fl\xe2\x80\xa6 https://t.co/IZC5buWKA0'"
1035429564401557505,2018-08-31 07:30:20,"b""@MichaelZhuge Hi there, we do not have a carnival this year; in its place is the event we've mentioned earlier. Mor\xe2\x80\xa6 https://t.co/4mvhUL7YZg"""
1035427362509414400,2018-08-31 07:21:35,"b'@seriouspalates Hi Terence, may we know if they are still following up with you on this matter? Thank you.'"
1035417385648508928,2018-08-31 06:41:56,"b'@Brian_TCtravel Hi Brian, thank you for reaching out to us. Yes, you can carry a camera bag/handbag in addition to\xe2\x80\xa6 https://t.co/TyN64YE9Ep'"
1035416201441239040,2018-08-31 06:37:14,"b""@seriouspalates Hi Terence, we've replied to your Facebook post; you may wish to check, thank you."""
1035378630510215168,2018-08-31 04:07:56,"b""@akosiangelic Because your stated layover period cuts quite close to this, we'd recommend that you ask the check-in\xe2\x80\xa6 https://t.co/E9WAAAAMvU"""
1035378525405106176,2018-08-31 04:07:31,"b""@akosiangelic Hi there, usually for a layover of more than 24 hours, you'll have to collect your bags in SIN and re-check them in. (1/2)"""
1035360617111216130,2018-08-31 02:56:21,"b'@nkl0x55 Thank you for sharing. This is a known phishing attempt and we have already updated it, along with other n\xe2\x80\xa6 https://t.co/Qmnn0fe5w1'"
1035351235895934983,2018-08-31 02:19:05,"b'@PeterisCiemitis Sorry to hear this, Peteris. May we know if you had the opportunity to lodge a report about your l\xe2\x80\xa6 https://t.co/jiI03buHJJ'"
1035300321994661888,2018-08-30 22:56:46,"b'@MichaelZhuge Hi there, we have a pop-up on Orchard road, jointly hosted by SIA and SGP (Singapore Grand Prix) from\xe2\x80\xa6 https://t.co/Y8eZxv2C8n'"
1035299320625545216,2018-08-30 22:52:47,"b'@NielsB73 Hi Niels, we are very glad to hear this. We wish you a pleasant flight ahead :)'"
1035298482305818624,2018-08-30 22:49:27,"b'@LinHolman4 Hi Lin, you may wish to contact our lost and found office via 020 8745 2166. Thank you'"
1035297756833898499,2018-08-30 22:46:34,"b'@z_kb Hi Karthik, thank you for your feedback. We are glad you had a positive experience :)'"
1035212618817056770,2018-08-30 17:08:16,"b'@lmdo Thank you for the clarification, Linh. May we seek your booking reference number, choice of meal and contact\xe2\x80\xa6 https://t.co/AbWS6TmuTW'"
1035209579850809344,2018-08-30 16:56:11,"b'@lmdo Hi Linh, may we check if you are receiving an error message? Thank you.'"
1035205022861205504,2018-08-30 16:38:05,"b'@lmdo Hi Linh, you may wish to contact your nearest Singapore Airlines office via https://t.co/iV4aCjN7Ad. Thank you.'"
1035136286682755072,2018-08-30 12:04:57,"b""@thejagjitfan That's cool, AK. Looking forward to welcome you onboard our flights then. :)"""
1035101435556454400,2018-08-30 09:46:28,"b'@GeorgeHThomas Thank you for your kind words, George. Looking forward to welcome you onboard again in the near future! Cheers. :)'"
1035092346453598208,2018-08-30 09:10:21,"b'@Lawrence_long69 Hi Lawrence, we understand it was due to passenger handling that led to the delay. Thank you.'"
1035090617452388352,2018-08-30 09:03:28,"b""@alishaw_ Hi Ali, that's correct for customers travelling in Premium Economy Class from UK to Australia. The allowa\xe2\x80\xa6 https://t.co/NTgpbajBTK"""
1034985577173667840,2018-08-30 02:06:05,"b'@prachisalvi Hi Prachi, we are sorry but any special request (subject to approval) must be made no later than 24 ho\xe2\x80\xa6 https://t.co/adHmizrS6l'"
1034984901756563459,2018-08-30 02:03:24,"b'@wxxec Hi Stu, please email your booking ref, contact details, meal preference to sq_social@singaporeair.com.sg and\xe2\x80\xa6 https://t.co/5y68w5iNO9'"
1034979918671695873,2018-08-30 01:43:36,"b'@wxxec Hi Stu, sorry we are not using the DM function currently. May we know the date of travel on SQ338? Thank you.'"
1034975528032321536,2018-08-30 01:26:09,"b'@wxxec Hi Stu, may we know the issue or error message that you have encountered? Thank you.'"
1034970962842845184,2018-08-30 01:08:01,"b'@pa_nu You are welcome, and we look forward to seeing you onboard soon! :)'"
1034968539420139520,2018-08-30 00:58:23,"b'@pa_nu Hi Panu, any personal electronic devices (PED) such as laptop/iPad will need to be stowed (i.e. cannot be us\xe2\x80\xa6 https://t.co/e1l1MbFWBs'"
1034966326043992065,2018-08-30 00:49:35,"b'@jeffcheong You are welcome, Jeff. Rest well, and enjoy the ride! :)'"
1034962643298213889,2018-08-30 00:34:57,"b'@pa_nu Hi Panu, may we know on which flight/aircraft will you be taking? Thank you.'"
1034953260673761280,2018-08-29 23:57:40,"b'@iangriffin Hi Ian, we regret that regarding complimentary upgrades, we do not give free upgrades in view of our cu\xe2\x80\xa6 https://t.co/7pNFnJ4RRV'"
1034929968671805440,2018-08-29 22:25:07,"b'@ModyD88 Hi there, upgrades are subject to your fare conditions. Alternatively, you may wish to click here:\xe2\x80\xa6 https://t.co/FcUIrk9UyO'"
1034922460838354945,2018-08-29 21:55:17,"b""@ModyD88 Hi there, if you're a KrisFlyer member, you may wish to redeem your miles for an upgrade. Please click her\xe2\x80\xa6 https://t.co/ckburoaW0N"""
1034914217500069889,2018-08-29 21:22:31,"b'@iam_kih Hi Khalid, you may wish to click here: https://t.co/f3n5WF6UjT for more details on travelling to Singapore. Thank you.'"
1034891952024633349,2018-08-29 19:54:03,"b""@iam_kih Hi Khalid, you may join our free city tour as long as you've at least 5.5hrs to spare till your connecting\xe2\x80\xa6 https://t.co/wOXPkwUPGV"""
1034866444717223937,2018-08-29 18:12:41,"b""@ronettte Hi there, we're sorry to hear this. If we may advise, you may wish to try clearing your browser's cache a\xe2\x80\xa6 https://t.co/6hZ3jE66mE"""
1034851226238767105,2018-08-29 17:12:13,"b'@bergkamp594 Thank you for clarifying, Andrew. May we seek your booking reference number and contact details via sq\xe2\x80\xa6 https://t.co/wev8hs11zk'"
1034848958466715655,2018-08-29 17:03:12,"b""@BThreadwell We're sorry to hear this, Billy. May we seek your booking reference number, seat number, and contact d\xe2\x80\xa6 https://t.co/UDZVPAHHzw"""
1034841480114909185,2018-08-29 16:33:29,"b""@ChasBegley Hi Chas, we're delighted to hear this! May we know how we've exceeded your expectations? :D"""
1034841047161958400,2018-08-29 16:31:46,"b'@bergkamp594 Hi Andrew, thank you for clarifying. May we know if your ticket was booked directly through us or from\xe2\x80\xa6 https://t.co/uCJdxHJf5C'"
1034798146306695168,2018-08-29 13:41:18,"b""@bergkamp594 Hi Andrew, we're sorry to hear this. May we know what customer service are you referring to and if you\xe2\x80\xa6 https://t.co/azQgKtsVZV"""
1034791436305268737,2018-08-29 13:14:38,"b""@stuartcrees Nice picture, Stuart. We hope you'll have a safe and pleasant flight with us! :)"""
1034778795599949825,2018-08-29 12:24:24,"b'@samjoss007 Hi there, we are unable to accept DMs. You may wish to email your concerns to sq_social@singaporeair.com.sg. Thank you.'"
1034732279950700545,2018-08-29 09:19:34,"b'@stuartcrees We are glad to hear of your positive experience, Stu :)'"
1034730209059196931,2018-08-29 09:11:20,b'@RhythmicalMike Thank you for the clarification. You may wish to contact your nearest Singapore Airlines office via\xe2\x80\xa6 https://t.co/nbzGQjMDXE'
1034715077222584326,2018-08-29 08:11:13,"b'@thekuehdiaries Hi Joanna, may we clarify if you have been in touch with any of our colleagues regarding this?'"
1034713171032981504,2018-08-29 08:03:38,"b'@RhythmicalMike Hi there, may we check if you have filed a baggage report with our airport ground staff? Thank you.'"
1034649726854066182,2018-08-29 03:51:32,"b'@danieljfhayter Hi Daniel, we are sorry to hear this. May we check if you have been assisted?'"
1034601657382920192,2018-08-29 00:40:31,"b'@DylanFurnell88 Hi Dylan, sorry to hear this.May we seek more details for our understanding? Thank you.'"
1034585879535382529,2018-08-28 23:37:50,"b'@fireopal82 Having said this, you can still change your seat for free from 48 hours up to 1.5 hours before your fli\xe2\x80\xa6 https://t.co/2uDIi4Tsyx'"
1034585776632352773,2018-08-28 23:37:25,"b'@fireopal82 Hi there, all seat selections made in advance are not refundable or transferable to another seat. If yo\xe2\x80\xa6 https://t.co/Wgb6kJDjhz'"
1034582000357859328,2018-08-28 23:22:25,"b'@PANDANS Hi there, may we request for your e-ticket number, as well as your full name (as how it appears on your pa\xe2\x80\xa6 https://t.co/5bkSIJXQCI'"
1034580704380768259,2018-08-28 23:17:16,"b'@omarruizak Hi Omar, we are not able to advise here, but our colleagues in Reservations will be able to. You may co\xe2\x80\xa6 https://t.co/hcMY0zt0qB'"
1034577510284095488,2018-08-28 23:04:34,"b'@fireopal82 Hi there, depending on the fare type you choose, you may select a seat in advance for free or a fee. Al\xe2\x80\xa6 https://t.co/U0ehGDvBRP'"
1034567682555883521,2018-08-28 22:25:31,"b""@omarruizak Hi Omar, we're happy to welcome you and your best friend onboard in November. While we are not able to\xe2\x80\xa6 https://t.co/Zte59Vcumc"""
1034566859910275077,2018-08-28 22:22:15,"b'@danielcfng Thanks for sharing, Daniel! Great to hear you are enjoying the mee siam! We hope you will also enjoy your flight with us.'"
1034565679318487040,2018-08-28 22:17:33,"b'@vleuten6 Hi Pedro, are you referring to our website? May we know what you meant by the ""sit go away"" so that we ca\xe2\x80\xa6 https://t.co/APRpF7bJTD'"
1034492583806951424,2018-08-28 17:27:06,"b'@dialogirl Thank you for your kind words, Jodi :)'"
1034432519867981824,2018-08-28 13:28:26,"b""@ainzaimim Hi, we'd like to share that the food served at our lounges in Changi Airport are not halal-certified."""
1034431947836194824,2018-08-28 13:26:09,b'@sjhan May we seek your KrisFlyer number and preferred contact number via SQ_Social@singaporeair.com.sg for us to s\xe2\x80\xa6 https://t.co/Jr1UVxDjAr'
1034430952334868480,2018-08-28 13:22:12,"b'@JanLohman Hi Jan, if you receive any memorabilia from us, be it pens or other items, when travelling with us, you\xe2\x80\xa6 https://t.co/hGwYwW2Gal'"
1034422290476347393,2018-08-28 12:47:47,b'@sjhan May we clarify which number you had called? Thank you.'
1034419405059489792,2018-08-28 12:36:19,"b'@jasongraham99 Hi Jason, to better assist you, do you have a screenshot on how ""the price is higher"" when you try t\xe2\x80\xa6 https://t.co/gKskeX4usK'"
1034418786756112384,2018-08-28 12:33:51,"b'@jasongraham99 Hi there, if we may share, a service fee will be charged when you make reservations and ticketing re\xe2\x80\xa6 https://t.co/w8Y6HEq2Sa'"
1034416649217224704,2018-08-28 12:25:22,"b'@ainzaimim Hi there, may we clarify that your query is regarding the food served in our SilverKris/KrisFlyer Gold L\xe2\x80\xa6 https://t.co/qOl0APL8WY'"
1034414698165403648,2018-08-28 12:17:37,"b""@JanLohman Hi Jan, may we clarify if you're asking to receive a pen, that has our Singapore Airlines' logo on it, a\xe2\x80\xa6 https://t.co/U9C3rehlzF"""
1034407936032956416,2018-08-28 11:50:44,"b'@OzJaycee Hi there, we regret that to gain access into our lounges with a Virgin Flying Club Gold membership, passe\xe2\x80\xa6 https://t.co/I52l7eR4pX'"
1034407193053999104,2018-08-28 11:47:47,"b'@NikiV Hi Niki, yes, you may. To make your transit experience more exciting, you may wish to check out the Free Sin\xe2\x80\xa6 https://t.co/eLUEONEW71'"
1034391914802552832,2018-08-28 10:47:05,"b""@OzJaycee Hi there, if you're a Virgin Flying Club Gold member and are travelling on SIA (an SQ ticket), you may ac\xe2\x80\xa6 https://t.co/oQ1ibNU2H3"""
1034385705194143744,2018-08-28 10:22:24,"b'@rohanneets Hi Rohan, if we may clarify, the T3 Ambassador Transit Lounge is not managed by us. Our lounges are Sil\xe2\x80\xa6 https://t.co/yLwDyrOjC7'"
1034374900407054336,2018-08-28 09:39:28,"b'@ReefCorral Hi there, may we know more details to your query to better assist you? Thank you.'"
1034373432622940161,2018-08-28 09:33:38,"b'@rohanneets Hi Rohan, yes, you may use the voucher at the T3 Ambassador Transit Lounge, Do click here:\xe2\x80\xa6 https://t.co/tMdaawfPaw'"
1034355161941139457,2018-08-28 08:21:02,"b'@nahlazil Thank you for your kind words and support, Nahla! \xf0\x9f\x98\x8a'"
1034350131984916480,2018-08-28 08:01:03,b'Love the local fare of Singapore? Enjoy iconic Singaporean dishes at our lounges in Changi Airport Terminal 2 and 3\xe2\x80\xa6 https://t.co/uaXnw5ldz1'
1034349372719489024,2018-08-28 07:58:02,"b'@1NRSmith Hi Nicholas, thank you for your query. May we seek your booking reference number via sq_social@singaporea\xe2\x80\xa6 https://t.co/MjM3wvf1DI'"
1034325007953014784,2018-08-28 06:21:13,"b""@victortoojy We're sorry to hear this, Victor, and we note on your feedback regarding our mobile app and website. M\xe2\x80\xa6 https://t.co/mC90ZYhtBv"""
1034310644261117955,2018-08-28 05:24:08,"b'@sjhan Hi there, thank you for reaching out to us. May we clarify if your query is regarding the redemption of Chas\xe2\x80\xa6 https://t.co/54S0MktRFP'"
1034270500510416896,2018-08-28 02:44:37,"b""@IanShraeger We're delighted to hear this, Ian! Thank you for sharing your Singapore Airlines experience and we loo\xe2\x80\xa6 https://t.co/x0BsvEU0Af"""
1034270068086136832,2018-08-28 02:42:54,"b'@drewdeakin Hi Drew, if we may share, we do not have compassionate airfares. However, please feel free to contact y\xe2\x80\xa6 https://t.co/yxNqh5OS9K'"
1034153941901168641,2018-08-27 19:01:28,"b""@real_eloy Hi Eloy, sorry but it's not possible. Thank you."""
1034153614472867840,2018-08-27 19:00:09,"b'@real_eloy Hi Eloy, sorry we are not using the DM function currently. Thank you.'"
1034142191273365514,2018-08-27 18:14:46,"b'@rtwbrad Hi, you may check in your baggage all the way to DEL, without having to pick it up in SIN. Thank you.'"
1034114352637460480,2018-08-27 16:24:09,"b'@serenade0hana Hi, the 24 hours Reservation call centre number is +65 6223 8888. Thank you.'"
1034100825017200641,2018-08-27 15:30:24,"b'@serenade0hana Hi, you may wish to contact your local SIA office to ensure the name in your booking and passport matches. Thank you.'"
1034097903843926019,2018-08-27 15:18:47,"b'@serenade0hana Hi Hana, may we confirm if you have a problem trying to login to the check in page? Thank you.'"
1034089520189333504,2018-08-27 14:45:28,"b'@stunninwmylove Hi Michael, it will be 1x piece, up to 7kg. More information can be found here: https://t.co/hLGQ3QCfy0 Thank you.'"
1034078877625327617,2018-08-27 14:03:11,"b'@mcpeebuu Hi, you may wish to refer to the Careers section on our website for more information about job applicatio\xe2\x80\xa6 https://t.co/isczoq07IE'"
1034077847844020226,2018-08-27 13:59:05,"b'@deniselin52 Hi there, you may use the link here: https://t.co/BmsrMlR4hR  to check if your item left behind was found. Thank you.'"
1034070478347018242,2018-08-27 13:29:48,"b'@shinilikity Hi, we do not have the DM function currently. Please email us the details via sq_social@singaporeair.c\xe2\x80\xa6 https://t.co/8zutjLtATz'"
1034069178045685761,2018-08-27 13:24:38,"b""@jasongraham99 Hi Jason, we'd suggest booking the entire travelling party together at one go, and to leave out non-\xe2\x80\xa6 https://t.co/2rJIET8cEY"""
1034068480734232576,2018-08-27 13:21:52,"b'@shinilikity Hi, sorry to learn that. May we know if you have made a report upon arrival with our ground staff? Thank you.'"
1034048962821533696,2018-08-27 12:04:19,"b'@jasongraham99 Hi Jason, sorry to hear about how you feel. May we know for how many people are you making the online booking for? Thank you.'"
1034042163775119360,2018-08-27 11:37:18,"b""@AMITSHA18947506 Hi Amit, we're sorry to hear about this. May we know what was advised to you by our customer repre\xe2\x80\xa6 https://t.co/En5oYpcjYK"""
1034024284233117696,2018-08-27 10:26:15,"b""@kencodynz We're sorry to hear about this, Ken. May we seek your intended travel itinerary (dates, destinations, pa\xe2\x80\xa6 https://t.co/sduvBlTlvS"""
1034023353277972483,2018-08-27 10:22:33,"b""@anne_emer Hi Emer, if we may advise, you may wish to try clearing your browser's cache and history before attempti\xe2\x80\xa6 https://t.co/DmrPmhMECY"""
1034012195145830400,2018-08-27 09:38:12,"b""@Aussie222Dan We're sorry to hear this, Dan, and we regret that we are unable to advise differently. We have noted\xe2\x80\xa6 https://t.co/XV1wOKpb1e"""
1034003097398534149,2018-08-27 09:02:03,"b'@traveltips4trip Hi there, thank you for the details. You may use the media from our website in your flight review\xe2\x80\xa6 https://t.co/tHuRWBhmRC'"
1033997578562625538,2018-08-27 08:40:08,"b'@adelecakes85 Thank you for clarifying, Adele, and we appreciate your kind words for our cabin crew. We hope you an\xe2\x80\xa6 https://t.co/ggOBJIf8Zo'"
1033996006998913024,2018-08-27 08:33:53,"b'@gutoaraki Additionally, please delete this tweet of yours as it contains your booking reference numbers which are\xe2\x80\xa6 https://t.co/UqM5VA5Y6I'"
1033995719047344128,2018-08-27 08:32:44,"b""@gutoaraki We're sry to hear this, Guto. We seek ur understanding that the operating airline responsible for the or\xe2\x80\xa6 https://t.co/V1LSoTFTOu"""
1033989672429600769,2018-08-27 08:08:43,"b'@rriana Thank you for your kind words and support, Riana. We hope to welcome you onboard again in the near future!'"
1033989374407585792,2018-08-27 08:07:32,"b'@gutoaraki Hi Guto, may we know more details on your concern to see how best to assist you? Thank you.'"
1033988504651481088,2018-08-27 08:04:04,"b'@anne_emer Hi Emer, you may wish to contact our KrisFlyer Membership Services at +65 6789 8188 or email KF_contact@\xe2\x80\xa6 https://t.co/4Ze4mHV90P'"
1033980766693347328,2018-08-27 07:33:19,"b""@traveltips4trip Hi Sally, thank you for your kind words and we're glad that you enjoyed your flight with us. May w\xe2\x80\xa6 https://t.co/fpM7dsE5M5"""
1033980268015693825,2018-08-27 07:31:20,"b'@Aussie222Dan Thank you for clarifying, Dan. We have noted on your feedback regarding our mobile app. May we know i\xe2\x80\xa6 https://t.co/mameEAYE2A'"
1033979705228255233,2018-08-27 07:29:06,"b""@anne_emer Hi Emer, we're sorry to hear about this. May we know if you received any error message whilst trying to\xe2\x80\xa6 https://t.co/LwD1HMTE14"""
1033959283203948544,2018-08-27 06:07:57,"b'@puba51 Hi there, you may wish to click here: https://t.co/f3n5WF6UjT for more info on the entry requirements to Singapore. Thank you.'"
1033938766644305920,2018-08-27 04:46:26,"b'@BackstreetNomad Have a great one, Luke! \xf0\x9f\x91\x8d'"
1033918573197049856,2018-08-27 03:26:11,"b'@1saponatime Hi there, thank you for reaching out to us. We wish to advise you to exercise discretion when revealin\xe2\x80\xa6 https://t.co/dnvgSRwsbL'"
1033916937565294594,2018-08-27 03:19:41,"b'@p___j____ Hi there, you can carry up to two bags into the cabin with you depending on your class of travel. Do cli\xe2\x80\xa6 https://t.co/rVdSkWSFab'"
1033905183556820992,2018-08-27 02:32:59,"b'@cqinhong Hi there, if we may share, our Elite Gold KF members can select Standard &amp; Forward zone seats for free. A\xe2\x80\xa6 https://t.co/8c4wqLFg8g'"
1033888359486287872,2018-08-27 01:26:08,"b""@hollyschase Hi Holly, we're sorry to hear about this. Please be assured that our friendly cabin crew will be there\xe2\x80\xa6 https://t.co/kTV0WY90Hp"""
1033886905593749513,2018-08-27 01:20:21,"b""@Aussie222Dan Hi Dan, we're sorry to hear about this. May we know if you received any error message whilst trying t\xe2\x80\xa6 https://t.co/muuCbuOeiE"""
1033866282821664771,2018-08-26 23:58:24,"b'@kencodynz Hi Ken, thanks for letting us know about this May we know if you were able to make a booking since? Thank you.'"
1033837548412526592,2018-08-26 22:04:13,"b'@puba51 Hi there, while we do not provide accommodation, you may wish to consider one of one of our packages that i\xe2\x80\xa6 https://t.co/bBlK1QfznK'"
1033719158591172608,2018-08-26 14:13:47,"b'@MichaelZhuge Hi Michael, the carnival is scheduled from 30 August 2018. Do stay tuned to our social media platform\xe2\x80\xa6 https://t.co/hnaRUHWvoV'"
1033689747435204608,2018-08-26 12:16:55,"b'@PoloBearings Hi, we are sorry about how you felt, but we are unable to advise differently from what was communicat\xe2\x80\xa6 https://t.co/29PwJOwLuW'"
1033682732197597185,2018-08-26 11:49:02,"b'@TravelerPrash Hi Prashanth, you may wish to call our 24-hour Reservations call centre line at +65 6223 8888. Thank you.'"
1033678014989705217,2018-08-26 11:30:18,"b'@TravelerPrash Hi Prashanth, you will need to contact your local SIA office to make changes to your booking. Contac\xe2\x80\xa6 https://t.co/8LUbFLB12d'"
1033661617794375687,2018-08-26 10:25:08,"b'@Khoa_Huynh Our pleasure and nice photo, Khoa! Hope you will enjoy the flight. :)'"
1033639259847180288,2018-08-26 08:56:18,"b""@vlegowozipperer Hi Vidi, we have received your husband's email and we have responded accordingly. Thank you."""
1033628623213867008,2018-08-26 08:14:02,"b'@1Ddreamer_teen Yes, the flights are operated by different carriers. However, if the flights are all booked under a\xe2\x80\xa6 https://t.co/rHovhI7L0P'"
1033625820403658752,2018-08-26 08:02:54,b'Campsite with a view. RT with your favourite locations! #FlySQ https://t.co/oLTPrNnssa'
1033624518798073856,2018-08-26 07:57:43,"b'@TimMorrisMusic @ClaireMason We wish the both of you a pleasant flight, and a memorable trip ahead! :)'"
1033623551511867392,2018-08-26 07:53:53,"b'@1Ddreamer_teen Hi, you may request to have your baggage checked in to your final destination without having to pic\xe2\x80\xa6 https://t.co/tJB1p8vyFu'"
1033622686809894912,2018-08-26 07:50:26,b'@DrEKirkeOstm We wish you a pleasant flight ahead! :)'
1033616664368238592,2018-08-26 07:26:31,"b'@Guillaume_Rosec May we suggest clearing your cache/browser history before trying again? Also, please do not open m\xe2\x80\xa6 https://t.co/d5GMA2AFR6'"
1033610446610333696,2018-08-26 07:01:48,"b'@Guillaume_Rosec Hi Guillaume, sorry to hear that. May we know if you are currently experiencing any issue? Thank you.'"
